id,Title,Category,Tags,Date
1,"Kanser Sonrası Hayata Dönüş Neden Zordur?",Blog,Kanser,2025-06-20
2,"Meme Kanseri Sonrası Yeni Yaşama Uyum",Online Webinar,Meme Kanseri,2026-06-09
3,"MENOPOZDA KENDİNE RESET PROGRAMI-1",Program,Menopoz,2025-11-20
4,"İLK GECE KORKUSU NEDEN YAŞANIR?",Video,Cinsel Sağlık,2025-12-06
5,"DOĞUM SONRASI CİNSELLİK NASIL OLMALI ?",Video,Cinsel Sağlık,2025-12-06
6,"CİNSEL TERAPİST NE YAPAR?",Video,Cinsel Sağlık,2025-12-06
7,"RAHİM AĞZI KANSERİ NEDEN OLUŞUR?",Video,Kanser,2025-12-06
8,"Gebelikte Beslenme ve Dikkat Edilmesi Gerekenler",Blog,Gebelik,2025-05-10
9,"Normal Doğum mu Sezaryen mi?",Article,Doğum,2025-04-12
10,"Kadın Sağlığında Düzenli Kontrolün Önemi",Guide,Genel Sağlık,2025-03-22
11,"PCOS Belirtileri ve Tedavi Yöntemleri",Blog,Hormonal Sağlık,2025-02-15
12,"Miyomlar Hakkında Bilinmesi Gerekenler",Blog,Jinekoloji,2025-01-05
13,"Vajinismus Tedavisinde Cinsel Terapi",Video,Cinsel Sağlık,2024-12-20
14,"Hamilelikte Egzersiz Rehberi",Program,Gebelik,2024-11-30
15,"Lohusalık Döneminde Psikolojik Destek",Blog,Psikoloji,2024-10-15